{
  "format": "svm.scenario/1",
  "id": "moveset.spy-step-blocked",
  "title": "Spy walks slowly into a 50 uu step: too high to step up, too slow to hop",
  "map": "MounE",
  "mode": "playlevel",
  "players": [
    {
      "team": "spy"
    }
  ],
  "spawn": {
    "floor": [
      4200.0,
      -2188.0,
      -723.5
    ],
    "yaw": 0,
    "clearance": 2.0,
    "spot": "pit floor z -723.5, 112 uu west of the block, facing it (+X)",
    "notes": "A 50 uu block (StaticMeshActor6600, top z -673.5, x 4346.7 to 4415, y -2228 to -2138) on the pit floor z -723.5 of the ladder room, with LG 502 along its west lip at z -674.5 (49 over the floor, inside the auto hop window 40 to 64). A standing box swept east along y -2188 stops at x 4311.7. Found with re/tools/difftest/movespots.py (steps)."
  },
  "setup": [
    {
      "op": "leaveGE",
      "maxFrames": 240
    },
    {
      "op": "teleport"
    },
    {
      "op": "stance",
      "crouched": false
    },
    {
      "op": "fastSpeed",
      "value": false
    },
    {
      "op": "write",
      "target": "pawn",
      "field": "Health",
      "value": 100
    },
    {
      "op": "view",
      "pitch": 0,
      "yaw": 0
    },
    {
      "op": "waitStill",
      "maxFrames": 180
    }
  ],
  "settleFrames": 30,
  "durationFrames": 120,
  "inputs": [
    {
      "frame": 0,
      "buttons": {
        "BT_Up": 1
      },
      "note": "walk slowly into the step (169 uu/s, under the 300 of the auto hop)"
    },
    {
      "frame": 90,
      "buttons": {
        "BT_Up": 0
      },
      "note": "let go"
    }
  ],
  "repeats": 3,
  "profile": "locomotion",
  "measure": {},
  "covers": [
    "uc:SBase.SPlayerController:s_PlayerWalkingMario.PlayerMove",
    "uc:SBase.SPlayerController:UpdatePawnRotationMario",
    "nat:SBase.SPlayerController.NativeComputeControlVariables",
    "uc:SBase.SPlayerController:s_PlayerWalkingSt0H.PlayerTick",
    "def:SBase.SPawnAttaque"
  ]
}
