{
  "format": "svm.scenario/1",
  "id": "traversal.spy-pipe-climb-down",
  "title": "Spy grabs the pipe from the yard, climbs up 2.5 s, stops, climbs back down to the floor",
  "map": "SteeE",
  "mode": "playlevel",
  "players": [
    {
      "team": "spy"
    }
  ],
  "spawn": {
    "floor": [
      -1918.0,
      1336.0,
      -1127.5
    ],
    "yaw": 16384,
    "clearance": 2.0,
    "spot": "yard floor 120 uu south of PIPE GE 22, facing it (+Y)",
    "notes": "PIPE GE 22: bottom (-1918, 1456, -1128) on the yard floor z -1127.5, top (-1918, 1456, 152) flush with the roof z 152.5, side point 10 uu toward -Y (the climber's side). A standing spy box swept toward it stops 35.7 uu from the pipe (its mesh), inside the 20 uu grab window round the spot 35 uu out. Floor z -1127.5 at 60, 120 and 180 uu out; the roof is z 152.5 at 40 to 120 uu behind the top. Found with re/tools/difftest/gespots.py (pipe)."
  },
  "setup": [
    {
      "op": "leaveGE",
      "maxFrames": 240
    },
    {
      "op": "teleport"
    },
    {
      "op": "stance",
      "crouched": false
    },
    {
      "op": "fastSpeed",
      "value": true
    },
    {
      "op": "write",
      "target": "pawn",
      "field": "Health",
      "value": 100
    },
    {
      "op": "view",
      "pitch": 0,
      "yaw": 16384
    },
    {
      "op": "waitStill",
      "maxFrames": 180
    }
  ],
  "settleFrames": 30,
  "durationFrames": 420,
  "inputs": [
    {
      "frame": 0,
      "buttons": {
        "BT_Up": 1
      },
      "note": "walk into the pipe and climb"
    },
    {
      "frame": 170,
      "buttons": {
        "BT_Up": 0
      },
      "note": "stop on the pipe"
    },
    {
      "frame": 200,
      "buttons": {
        "BT_Down": 1
      },
      "note": "climb down to the floor"
    },
    {
      "frame": 336,
      "buttons": {
        "BT_Down": 0
      },
      "note": "let go on the floor (first walking frame is 334)"
    }
  ],
  "repeats": 3,
  "profile": "traversal",
  "measure": {},
  "covers": [
    "uc:SBase.SPlayerController:s_PlayerWalkingMario.Pipe",
    "uc:SBase.SPlayerController:s_GrabPipe.PlayerMove",
    "uc:SBase.SPlayerController:s_GrabPipe.AnimEnd",
    "uc:SBase.SPlayerController:s_OnPipe.BeginState",
    "uc:SBase.SPlayerController:s_OnPipe.PlayerMove",
    "uc:SBase.SBasePawn:SetPipeZones",
    "uc:SBase.SBasePawn:SendZipPAndNormalToServer",
    "uc:SBase.SPlayerController:s_OnPipe.NotifyHitWall"
  ]
}
