{
  "format": "svm.scenario/1",
  "id": "movement.spy-crouch-walk",
  "title": "Spy crouched walk forward for 3 s on flat ground (fast mode), then release",
  "map": "SteeE",
  "mode": "playlevel",
  "players": [
    {
      "team": "spy"
    }
  ],
  "spawn": {
    "floor": [
      -492.0,
      -2032.0,
      -1143.5
    ],
    "yaw": 16384,
    "clearance": 2.0,
    "spot": "east yard lane, heading +Y",
    "notes": "BSP floor z -1143.5, normal z 1.0 every 16 uu for 1792 uu along +Y; a spy box widened by 25 uu sweeps the lane clear; nearest GE 599 uu (an LG 145 uu higher); zone ZoneInfo1913. Found with re/tools/difftest/spots.py (editor live point.info and trace.box)."
  },
  "setup": [
    {
      "op": "teleport"
    },
    {
      "op": "stance",
      "crouched": true
    },
    {
      "op": "fastSpeed",
      "value": true
    },
    {
      "op": "write",
      "target": "pawn",
      "field": "Health",
      "value": 100
    },
    {
      "op": "view",
      "pitch": 0,
      "yaw": 16384
    },
    {
      "op": "waitStill",
      "maxFrames": 180
    }
  ],
  "settleFrames": 30,
  "durationFrames": 240,
  "inputs": [
    {
      "frame": 0,
      "buttons": {
        "BT_Up": 1
      },
      "note": "hold forward"
    },
    {
      "frame": 180,
      "buttons": {
        "BT_Up": 0
      },
      "note": "release after 3 s"
    }
  ],
  "repeats": 3,
  "profile": "locomotion",
  "measure": {
    "plateauSpeed": {
      "from": 90,
      "to": 180,
      "expect": 221.4
    },
    "accelTime": {
      "from": 0,
      "fraction": 0.9
    },
    "decelTime": {
      "from": 180,
      "fraction": 0.1
    }
  },
  "covers": [
    "uc:SBase.SPlayerController:s_PlayerWalkingMario.PlayerMove",
    "uc:SBase.SPlayerController:UpdatePawnRotationMario",
    "uc:SBase.SPlayerController:GetSpeedMode",
    "nat:SBase.SPlayerController.NativeComputeControlVariables",
    "uc:SBase.SPlayerController:s_PlayerWalkingCr0H.PlayerTick",
    "uc:SBase.SPlayerController:ProcessCrouch",
    "uc:SBase.SPlayerController:ComputeCrouchOrRoll",
    "def:SBase.SPawnAttaque"
  ]
}
