{
  "format": "svm.scenario/1",
  "id": "movement.spy-jump-in-place",
  "title": "Spy standing still jumps once and lands",
  "map": "SteeE",
  "mode": "playlevel",
  "players": [
    {
      "team": "spy"
    }
  ],
  "spawn": {
    "floor": [
      -492.0,
      -2032.0,
      -1143.5
    ],
    "yaw": 16384,
    "clearance": 2.0,
    "spot": "east yard lane, heading +Y",
    "notes": "BSP floor z -1143.5, normal z 1.0 every 16 uu for 1792 uu along +Y; a spy box widened by 25 uu sweeps the lane clear; nearest GE 599 uu (an LG 145 uu higher); zone ZoneInfo1913. Found with re/tools/difftest/spots.py (editor live point.info and trace.box)."
  },
  "setup": [
    {
      "op": "teleport"
    },
    {
      "op": "stance",
      "crouched": false
    },
    {
      "op": "fastSpeed",
      "value": true
    },
    {
      "op": "write",
      "target": "pawn",
      "field": "Health",
      "value": 100
    },
    {
      "op": "view",
      "pitch": 0,
      "yaw": 16384
    },
    {
      "op": "waitStill",
      "maxFrames": 180
    }
  ],
  "settleFrames": 30,
  "durationFrames": 150,
  "inputs": [
    {
      "frame": 30,
      "jump": true,
      "note": "jump (bPressedJump) from a standstill"
    }
  ],
  "repeats": 3,
  "profile": "locomotion",
  "measure": {
    "jumpApex": {
      "from": 30,
      "expect": 124.0
    },
    "airtime": {
      "from": 30,
      "expect": 0.813
    }
  },
  "covers": [
    "nat:SBase.SBasePawn.MyDoJump",
    "uc:SBase.SPlayerController:s_PlayerJump.BeginState",
    "uc:SBase.SPlayerController:s_PlayerJump.PlayerMove",
    "uc:SBase.SPlayerController:s_PlayerJump.AnimEnd",
    "uc:SBase.SPlayerController:s_PlayerJump.MyNotifyLanded",
    "uc:SBase.SPlayerController:MyNotifyLanded",
    "uc:SBase.SPlayerController:PlayerFalling.BeginState",
    "rep:Engine.LevelInfo.DefaultGravity",
    "uc:SBase.SPlayerController:s_PlayerWalkingMario.PlayerMove",
    "uc:SBase.SPlayerController:PlayerLanding.BeginState",
    "uc:SBase.SPlayerController:PlayerLanding.PlayerMove",
    "def:SBase.SPawnAttaque"
  ]
}
