{
  "format": "svm.scenario/1",
  "id": "traversal.spy-roll",
  "title": "Spy runs 1 s down the east yard lane and dive-rolls, standing up at the end of the roll",
  "map": "SteeE",
  "mode": "playlevel",
  "players": [
    {
      "team": "spy"
    }
  ],
  "spawn": {
    "floor": [
      -492.0,
      -2032.0,
      -1143.5
    ],
    "yaw": 16384,
    "clearance": 2.0,
    "spot": "east yard lane, heading +Y (the R4 locomotion lane)",
    "notes": "BSP floor z -1143.5, normal z 1.0 every 16 uu for 1792 uu along +Y; a spy box widened by 25 uu sweeps the lane clear (the dive needs 350 uu clear ahead); nearest GE 599 uu. Found with re/tools/difftest/spots.py."
  },
  "setup": [
    {
      "op": "leaveGE",
      "maxFrames": 240
    },
    {
      "op": "teleport"
    },
    {
      "op": "stance",
      "crouched": false
    },
    {
      "op": "fastSpeed",
      "value": true
    },
    {
      "op": "write",
      "target": "pawn",
      "field": "Health",
      "value": 100
    },
    {
      "op": "view",
      "pitch": 0,
      "yaw": 16384
    },
    {
      "op": "waitStill",
      "maxFrames": 180
    }
  ],
  "settleFrames": 30,
  "durationFrames": 240,
  "inputs": [
    {
      "frame": 0,
      "buttons": {
        "BT_Up": 1
      },
      "note": "run (fast)"
    },
    {
      "frame": 60,
      "buttons": {
        "bRoll": 1
      },
      "note": "roll key: dive roll from the run (magnitude clamps to 4700)"
    },
    {
      "frame": 61,
      "buttons": {
        "bRoll": 0
      }
    },
    {
      "frame": 150,
      "buttons": {
        "BT_Up": 0
      },
      "note": "let go after the roll"
    }
  ],
  "repeats": 3,
  "profile": "traversal",
  "measure": {},
  "covers": [
    "uc:SBase.SPlayerController:ComputeCrouchOrRoll",
    "uc:SBase.SPlayerController:s_PlayerWalkingMario.PlayerMove",
    "uc:SBase.SPlayerController:s_PlayerRolling.BeginState",
    "uc:SBase.SPlayerController:s_PlayerRolling.PlayerMove",
    "uc:SBase.SPlayerController:s_PlayerRollingUp.AnimEnd",
    "uc:SBase.SPlayerController:UpdatePawnRotationMario",
    "nat:SBase.SBasePawn.CanUnCrouch"
  ]
}
