{
  "format": "svm.scenario/1",
  "id": "moveset.merc-step-curb",
  "title": "Merc walks north across a 1.1 uu gutter and up a 17.1 uu curb, turns and walks back down it",
  "map": "SteeE",
  "mode": "playlevel",
  "players": [
    {
      "team": "merc"
    }
  ],
  "spawn": {
    "floor": [
      -2047.7,
      960.0,
      -1143.5
    ],
    "yaw": 16384,
    "clearance": 2.0,
    "spot": "yard floor z -1143.5, 160 uu south of the gutter, facing north (+Y)",
    "notes": "As moveset.spy-step-curb."
  },
  "setup": [
    {
      "op": "leaveGE",
      "maxFrames": 240
    },
    {
      "op": "teleport"
    },
    {
      "op": "stance",
      "crouched": false
    },
    {
      "op": "write",
      "target": "pawn",
      "field": "Health",
      "value": 100
    },
    {
      "op": "view",
      "pitch": 0,
      "yaw": 16384
    },
    {
      "op": "waitStill",
      "maxFrames": 180
    }
  ],
  "settleFrames": 30,
  "durationFrames": 220,
  "inputs": [
    {
      "frame": 0,
      "buttons": {
        "BT_Up": 1
      },
      "note": "walk north up the curb"
    },
    {
      "frame": 62,
      "buttons": {
        "BT_Up": 0
      },
      "note": "let go on the curb top"
    },
    {
      "frame": 80,
      "buttons": {
        "BT_Up": 1
      },
      "view": {
        "pitch": 0,
        "yaw": 49152
      },
      "note": "turn south and walk back down the curb"
    },
    {
      "frame": 150,
      "buttons": {
        "BT_Up": 0
      },
      "note": "let go"
    }
  ],
  "repeats": 3,
  "profile": "locomotion",
  "measure": {},
  "covers": [
    "uc:SBase.SPlayerController:s_PlayerWalkingWeapon.PlayerMove",
    "uc:SBase.SPlayerController:UpdatePawnRotationWeapon",
    "nat:SBase.SPlayerController.NativeComputeControlVariables",
    "uc:SBase.SPlayerController:s_PlayerWalkingSt2H.PlayerTick",
    "def:SBase.SPAWNDEFENSE"
  ]
}
