{
  "format": "svm.scenario/1",
  "id": "testrange.spy-ledge-pull-up",
  "title": "Spy hangs from the 264 ledge of TestRange and pulls up with forward, standing on the top",
  "map": "TestRange",
  "mode": "playlevel",
  "players": [
    {
      "team": "spy"
    }
  ],
  "spawn": {
    "floor": [
      1408.0,
      5788.0,
      0.0
    ],
    "yaw": 16384,
    "clearance": 2.0,
    "spot": "TestRange station Ledge264 (fixtures/testrange/stations.json): hall floor 100 uu south of the block's south face, facing it (+Y)",
    "notes": "LG Ledge264LG runs along the block top's south lip, (1280, 5888, 264) to (1536, 5888, 264), 264 above the floor z 0, the same as the SteeE container lip (LG 104, 263.5) this scenario's inputs were recorded on (traversal.spy-ledge-pull-up). The block is 256 deep with nothing over it up to the hall ceiling at 1024."
  },
  "setup": [
    {
      "op": "leaveGE",
      "maxFrames": 240
    },
    {
      "op": "teleport"
    },
    {
      "op": "stance",
      "crouched": false
    },
    {
      "op": "fastSpeed",
      "value": true
    },
    {
      "op": "write",
      "target": "pawn",
      "field": "Health",
      "value": 100
    },
    {
      "op": "view",
      "pitch": 0,
      "yaw": 16384
    },
    {
      "op": "waitStill",
      "maxFrames": 180
    }
  ],
  "settleFrames": 30,
  "durationFrames": 260,
  "inputs": [
    {
      "frame": 0,
      "buttons": {
        "BT_Up": 1
      },
      "note": "walk the last 100 uu to the wall (fast mode)"
    },
    {
      "frame": 40,
      "buttons": {
        "BT_Up": 0
      },
      "note": "let go at the wall: GroundSpeed 0, so the jump is not a wall jump"
    },
    {
      "frame": 55,
      "jump": true,
      "note": "jump on the spot under the lip"
    },
    {
      "frame": 100,
      "buttons": {
        "BT_Up": 1
      },
      "note": "forward: TestTopLedge, standing climb"
    },
    {
      "frame": 110,
      "buttons": {
        "BT_Up": 0
      }
    }
  ],
  "repeats": 3,
  "profile": "traversal",
  "measure": {},
  "covers": [
    "uc:SBase.SPlayerController:s_PlayerJump.Ledge",
    "uc:SBase.SPlayerController:GrabLedge.BeginState",
    "uc:SBase.SPlayerController:GrabLedge.PlayerMove",
    "uc:SBase.SPlayerController:GrabLedge.TopSynchro",
    "uc:SBase.SPlayerController:GrabLedge.AnimEnd",
    "uc:SBase.SPlayerController:OnLedge.BeginState",
    "uc:SBase.SPlayerController:OnLedge.PlayerMove",
    "nat:SBase.SPlayerController.CheckArmsZone",
    "uc:SBase.SBasePawn:SetLedgeGrabZones",
    "def:SBase.SPawnAttaque",
    "nat:SBase.SPlayerController.TestTopLedge",
    "uc:SBase.SPlayerController:TopLedge.PlayerMove",
    "uc:SBase.SPlayerController:TopLedge.AnimEnd"
  ]
}
